"Status","Start Time","Stop Time","Duration in ms","Parent Suite","Suite","Sub Suite","Test Class","Test Method","Name","Description"
"passed","Sat Sep 03 16:17:24 GMT 2022","Sat Sep 03 16:17:24 GMT 2022","1","Отправляем сетевые запросы","","","","","Вывести имена животных",""
"failed","Sat Sep 03 16:17:24 GMT 2022","Sat Sep 03 16:17:24 GMT 2022","3","Отправляем сетевые запросы","","","","","Проверить, что в массиве нет чётных чисел",""
"passed","Sat Sep 03 16:17:23 GMT 2022","Sat Sep 03 16:17:24 GMT 2022","273","Отправляем сетевые запросы","","","","","Получить все todos (результат в формате JSON), 200",""
"failed","Sat Sep 03 16:17:24 GMT 2022","Sat Sep 03 16:17:24 GMT 2022","176","Отправляем сетевые запросы","","","","","Проверить, что в челлендже нет 36 задачи",""
"failed","Sat Sep 03 16:17:24 GMT 2022","Sat Sep 03 16:17:24 GMT 2022","1","Отправляем сетевые запросы","","","","","Проверить, что в массиве нет чётных чисел, вариант 2",""
